<?xml version="1.0" encoding="UTF-8"?>
<!DOCTYPE ospf_conf SYSTEM "/usr/share/xml/vnx/ospf.dtd">

<ospf_conf>

   <vm name="ubuntu" type="quagga" subtype="lib-install">
      <zebra hostname="vm1" password="xxxx"/>
      <network>
         <ip mask="32">10.0.50.1</ip>
         <area>0.0.0.0</area>
      </network>
      <network>
         <ip mask="30">10.0.0.0</ip>
         <area>0.0.0.0</area>
      </network>	
      <network>
         <ip mask="30">10.0.0.4</ip>
         <area>0.0.0.0</area>
      </network>	
   </vm>

</ospf_conf>
